Sentence,Tag
"मैं नहीं जानता कि मेरी कलाई में किस चीज़ से अधिक दर्द होता है, वॉलीबॉल खेलना या महिलाओं की वॉलीबॉल देखना!",1
यह हास्यास्पद है कि कैसे चीनी लोग उन पदकों को वापस जीतने के लिए प्रतिस्पर्धा कर रहे हैं जो उन्होंने शायद एक महीने पहले बनाए थे!,1
ताज़ा समाचार: मंगलवार भी उतना ही बेकार है जितना सोमवार।,1
"तो आप एक अच्छे लड़के की तलाश में हैं जो आपसे प्यार करेगा और आपका सम्मान करेगा, लेकिन फिर भी आप अपने फेसबुक पर अर्ध नग्न तस्वीरें पोस्ट करते हैं? वह क्यों है .वह शानदार है!",0
एक लाइट बल्ब बदलने में कितने तलाकशुदा पुरुष लगते हैं?......कोई नहीं जानता कि वे कभी घर नहीं संभालते!,1
अंक! मेरी मित्र सूची में से किसी लड़की ने मुझसे आज रात ड्रिंक के लिए मिलने के लिए कहा! मुझे बस एटीएम तक पहुंचना है और 8 बजे तक 70 पाउंड वजन कम करना है।,0
धर्म एक बहु-अरब डॉलर का उद्योग है और जो लोग इससे आर्थिक रूप से लाभान्वित हो रहे हैं वे इस घोटाले को जारी रखने के लिए अपनी शक्ति में सब कुछ करेंगे।,0
मुझे इसकी परवाह नहीं कि मेरी उम्र कितनी है. मैं उछालभरे महल में जा रहा हूँ!,0
जो सबसे अंत में हंसता है वह सबसे धीमा है। जो सबसे पहले हंसता है उसका दिमाग सबसे गंदा होता है।,1
सार्वजनिक रूप से पागलपन भरी हरकतें करना और इसकी परवाह न करना क्योंकि आप अपने सबसे अच्छे दोस्तों के साथ हैं।,0
जीवन उन लोगों के बारे में नहीं है जो आपके सामने सच्चे व्यवहार करते हैं। यह उन लोगों के बारे में है जो आपकी पीठ पीछे सच्चे बने रहते हैं।,0
यदि आप वफादार नहीं हो सकते तो ब्रेक-अप कर लें। वफादार रहने के लिए या एकल रहना।,0
वह अजीब क्षण जब कोई व्यक्ति जिसे आप पसंद करते हैं वह आपसे बात करता है और आप बस एक बेवकूफ की तरह मुस्कुरा सकते हैं।,1
फेसबुक को मेरे समाचार फ़ीड में दिन का नाटक अनुभाग की आवश्यकता है।,0
"नासा का रोबोट क्यूरियोसिटी मंगल ग्रह पर उतरा। प्रारंभिक तस्वीरों में ईएसपीएन, बीयर और पोर्न का कोई संकेत नहीं दिखता, जिससे यह स्पष्ट हो जाता है कि पुरुष मंगल ग्रह से नहीं आए हैं।",1
"शांत हो जाएं, गहरी सांस लें और इसे लगभग 20 मिनट तक रोककर रखें।",1
"आज का मेनू: 1 गैलन रवैया, 3 कप व्यंग्य, 2 बड़े चम्मच मुझे अकेले छोड़ दो, और एक बड़ा कप शट द फ*क अप!",1
"आपके बारे में मेरी जो मूल ग़लतफ़हमी थी, उसे मैं हमेशा याद रखूँगा।",0
"कभी-कभी ""मैं अकेला हूं"" का अर्थ है ""मैं नाटक मुक्त हूं"", ""कम तनावग्रस्त हूं"" और ""मैं कम पर समझौता करने से इनकार करता हूं।""",1
महिलाओं का कहना है कि पत्रिकाएँ सुंदरता की अवास्तविक छवि पेश करती हैं जिससे उन्हें अपर्याप्तता का एहसास होता है। फिर उन्होंने 12 इंच का डिल्डो खरीदा।,1
"यदि फेसबुक ने कुछ भी साबित किया है, तो यह है कि आपके जीवन का प्यार वह है जिससे आप वास्तव में कभी नहीं मिले हैं।",0
"पिनाटा बच्चों को यह दिखाने का एक शानदार तरीका है कि घातक हथियार से हमला करना, जो वे चाहते हैं उसे पाने का एक मजेदार तरीका है।",0
आपने मुझे यहां बुलाया था: मैं पुलिस को बुला रहा हूं।,0
"मेरी सास आ रही हैं,,,,, मुझे अपनी आधी अलमारी खाली करनी पड़ी ताकि उन्हें उल्टा लटकने और सोने की जगह मिले",1
वह अजीब क्षण जब कोई आपको घूर रहा हो तो आप उसे न देखने की कोशिश कर रहे होते हैं।,0
"कृपया उन मित्रों पर ध्यान दें जो हास्य को नहीं समझते हैं, कृपया हमारे पोस्ट का उत्तर देने का प्रयास न करें जिनके पास हास्य की समझ है,,,, यह आपके कौशल स्तर से परे है।",1
मैं अपने अलार्म टोन के रूप में जस्टिन बीबर का गाना लगाता हूं और यह अद्भुत काम करता है क्योंकि मैं अलार्म बजने से पहले ही जाग जाता हूं इसलिए मुझे वह गाना नहीं सुनना पड़ता है,1
"ध्यान दें कि अब आप ""कोनी"" के बारे में नहीं सुनते? ख़ुशी है कि सभी ने पाँच मिनट तक ध्यान दिया।",0
"अगर आप रोना चाहते हैं तो टिशू का इस्तेमाल करें, अपने फेसबुक स्टेटस का नहीं।",1
मेरे जीवन का सबसे अच्छा समय या तो बुलबुले उड़ाने या स्तनों के साथ खेलने में बीता...,1
यह तब तक वास्तविक रिश्ता नहीं है जब तक आप गुप्त रूप से एक-दूसरे से नफरत करना शुरू नहीं करते।,0
"अब मैं समझ गया कि जमैका का झंडा हरा, पीला और काला क्यों है... यह केले का रंग है...",1
"समाचार: जर्मन गोताखोर को 0.0 अंक प्राप्त हुआ। जाहिर है, ओलंपिक जज तोप के गोलों की सराहना नहीं करते।",1
"अगर उनके पास फेसबुक के लिए ओलंपिक इवेंट होता, तो मेरा फेसबुक मित्र ड्रामा इवेंट में हर बार गोल्ड जीतता।",1
यदि आप इसे पढ़ रहे हैं तो संभवतः आप इंटरनेट के आदी हो गए हैं। और इंटरनेट से मेरा मतलब फेसबुक से है।,0
"जब भी मैं ऊब जाता हूँ तो किसी अजनबी को रोककर पूछता हूँ, ""मैं कहाँ हूँ?"" और वे जो कुछ भी कहते हैं मैं चिल्लाकर भाग जाता हूँ ""हाहाहा मैं एक प्रतिभाशाली हूँ! मैं टेलीपोर्ट कर सकता हूँ!""",0
मेरे पास वालरस जैसी प्रतिक्रियाएँ हैं! मूल रूप से मैं अपने अपार्टमेंट के चारों ओर घूमता हूं और जब मुझे खाना चाहिए होता है तो अपने पेट पर थप्पड़ मारता हूं,1
"मैं कम सोता हूं, मैं थका हुआ हूं। मैं अधिक सोता हूं, मैं थक गया हूं। जीवन असंभव है.",1
अंतत: शुक्रवार! ऐसा लगा जैसे यहाँ पहुँचने में एक सप्ताह लग गया!!,1
"कभी-कभी, मैं कोई ऐसी फिल्म देखूंगा जो मैंने बचपन में देखी थी और अचानक मुझे एहसास हुआ कि जब मैंने इसे पहली बार देखा तो मुझे पता ही नहीं था कि क्या हो रहा था।",0
"प्रिय नींद, मुझे पता है कि जब मैं छोटा था तो हमें समस्याएं थीं, लेकिन अब मैं तुमसे प्यार करता हूं।",1
वह अजीब 3 सेकंड का लैप डांस जो आपको फिल्मों में तब देखने को मिलता है जब कोई आपके पास से गुजरता है।,0
"ठीक है, शांत हो जाओ. यह एक मकड़ी है. बस एक छोटा सा टुकड़ा- होली मोली यह चला गया!",0
"मैंने अपनी पत्नी से कहा.. अगर वह कभी गुदा मैथुन का प्रयास करना चाहेगी, तो मैं हर तरह से उसके पीछे खड़ा रहूंगा।",1
10 में से 9 पुरुषों को बड़े स्तन वाली लड़कियां पसंद हैं और 10वें लड़के को बाकी 9 लड़के पसंद हैं।,1
"मैं वास्तव में न तो चल सकता हूँ और न ही बातचीत कर सकता हूँ, लेकिन यदि आपको पेय पीने के लिए किसी की आवश्यकता है, तो मैं आपका आदमी हूँ।",0
"एक हालिया अध्ययन में अनुमान लगाया गया है कि सभी फेसबुक खातों में से 8% फर्जी हैं... जब तक आप लोगों के व्यक्तित्व की गिनती नहीं करते, तब तक यह संख्या 93% तक पहुंच जाती है।",1
लोगों से नफरत करने में बहुत अधिक ऊर्जा लगती है। मैं बस दिखावा करता हूँ कि वे मर गये हैं।,0
"बाइबल काफी हद तक उन ऑनलाइन उपयोग की शर्तों के समझौतों की तरह है। हर कोई कहता है कि वे इससे सहमत हैं, लेकिन वास्तव में बहुत कम लोग इसे पढ़ते हैं।",0
"गलती से महिलाओं के लिए मल्टी विटामिन ले लिया और मैं पिछले 3 घंटों से तैयार होने की कोशिश कर रही हूं, लेकिन हर चीज मुझे मोटी दिखा रही है।",1
सेक्सी तब होती है जब एक महिला इतनी हॉट होती है कि वह इसका दिखावा कर सकती है लेकिन वह ऐसा नहीं करना चाहती।,0
मेरा बायोडाटा वास्तव में उन चीजों की एक सूची है जो मैं दोबारा कभी नहीं करना चाहता।,1
मैं इतना अमीर बनना चाहता हूं कि मुझे यह एहसास हो कि मैं खुशियां नहीं खरीद सकता।,0
"यह कहकर कि आप सेक्स के बाद सैंडविच चाहते हैं, आप मुझे बता रहे हैं कि आप सेक्स में आनंद लेते हैं क्योंकि आप मुझसे उम्मीद करते हैं कि मैं बाद में चलने में सक्षम हो जाऊँ।",0
मैं आपकी राय को तब तक महत्व देता हूं जब तक आप इसे पेश नहीं करते,1
मुझे इससे नफरत है जब मैं पीली बत्ती जलाने के लिए तैयार होता हूं और मेरे सामने वाला व्यक्ति चुपचाप निकल जाता है।,0
परमाणु ही हम सभी को पदार्थ बनाते हैं :),0
मैंने एक भी ओलंपिक पहलवान को स्लीपर होल्ड या फिगर फोर लेग लॉक का उपयोग करते नहीं देखा...,0
क्या मैं एकमात्र व्यक्ति हूं जो खुश है कि ओलंपिक आखिरकार ख़त्म हो गया?,1
यदि आप हमेशा एक ही बेवकूफ के साथ समाप्त होते हैं तो कृपया मुझे अपने रिश्ते की समस्याओं को सुनने की पीड़ा से बचाएं।,0
आप वास्तव में मुझे एक कड़वा इंसान बनने के लिए प्रेरित करते हैं।,0
"मैंने एक लड़के को यह शिकायत करते हुए सुना कि उसकी शादी में उसे कितना महंगा खर्च करना पड़ रहा है। लड़के, जब उसे पता चलेगा कि उसके तलाक पर कितना खर्च आएगा तो वह सचमुच मूर्ख बन जाएगा",1
"लोग कुछ हद तक भालू की तरह होते हैं, यदि आप बहुत शांत लेटे रहेंगे तो वे आप पर पंजा मारेंगे और फिर हार मान लेंगे और भोजन की तलाश में चले जाएंगे।",1
यदि मैं कभी भी मेरे द्वारा किए गए मूर्खतापूर्ण कार्यों की सूची बनाऊं तो मेरी पूर्व प्रेमिका शीर्ष पर होगी।,1
चीन ने ट्विटर को ब्लॉक कर दिया है. अब 1.3 अरब लोगों को पता नहीं होगा कि मैं दोपहर के भोजन में क्या ले रहा हूं।,1
मैं अवसाद रोधी दवाएँ नहीं खरीद सकता इसलिए मैं केवल नो मोर टीयर्स शैम्पू पी रहा हूँ।,1
एक बुद्धिमान व्यक्ति अपनी गलतियों से सीखता है। एक बुद्धिमान व्यक्ति दूसरों की गलतियों से सीखता है।,0
"आप कार चला रहे हैं. यह कोई टेलीफोन बूथ, ब्यूटी पार्लर या रेस्तरां नहीं है।",0
"जब मैंने पहली बार तुम्हें कमरे के उस पार से देखा, तो मुझे पता था कि मैं अपना शेष जीवन तुमसे बचते हुए बिताना चाहता हूँ।",1
"अगर मेरे पास बार होता तो मैं हर समय खुद को गोली मारता, शीशे में देखता, आंख मारता और कहता ""यह घर पर है।""",1
"मेरे पास एक अद्भुत बट होना चाहिए क्योंकि हर बार जब मैं किसी से बात खत्म करता हूं और दूर जाने के लिए मुड़ता हूं, तो मैं उन्हें फुसफुसाते हुए सुनता हूं, ""क्या गधा है!""",1
मेरी नई पार्टी चाल.. मैं डोरी के दो टुकड़े निगलता हूं और एक घंटे बाद वे एक साथ बंधे हुए मेरी गांड से बाहर आते हैं। मैं तुम्हें गाँठ बाँधता हूँ।,1
"केवल एक चीज जो मैं चाहूंगा कि आप मेरी पीठ पीछे कहें वह है ""क्या आपको यह पसंद है?""",0
"अब जब ओलंपिक समाप्त हो गए हैं, तो माइकल फेल्प्स को अंततः उनके प्राकृतिक आवास में वापस छोड़ा जा सकता है; एक बॉन्ग के साथ सोफ़ा.",0
"एलियन 1: ""क्या इंसानों को हमारा संदेश मिल गया?"" एलियन 2: ""हाँ, लेकिन उन्होंने इसे डब-स्टेप नाम दिया और इस पर नृत्य किया।""",1
महिलाएं अलार्म घड़ियों की तरह हैं। यह बहुत राहत की बात है जब उन्होंने आखिरकार मामला बंद कर दिया।,1
अद्यतन स्थिति.. कोई टिप्पणी नहीं करता। स्थिति फिर से अपडेट करें.,0
"प्यार का परफेक्ट होना जरूरी नहीं है, बस सच्चा होना जरूरी है।",0
मेरी सेक्स लाइफ फ़ेरारी की तरह है.. मेरे पास फ़ेरारी नहीं है,1
"उन्हें ""जर्सी शोर मीट्स शार्क वीक"" नाम से एक रियलिटी टीवी शो बनाना चाहिए।",0
मेरी एक्स के साथ मेरा रिश्ता पूरी तरह से मनोवैज्ञानिक था... वह एक मनोरोगी थी और मैं पूरी तरह तार्किक था।,1
जब मेरे पड़ोसियों ने अपने स्विमिंग पूल के चारों ओर बाड़ लगा दी तो मुझे गुस्सा आया लेकिन फिर मैंने उस पर काबू पा लिया,0
"संभवतः ""या क्या?!"" कहने का सबसे खराब समय जब पुलिस आपसे बंदूक छोड़ने और वाहन से बाहर निकलने के लिए कह रही हो।",0
"पोस्ट कार्ड पर लिखने लायक मजेदार बात: ""मौसम बहुत अच्छा है, खूब मजा आ रहा है! क्या आप अभी भी अपने मेलमैन की हत्या करने की योजना बना रहे हैं?""",1
वह अद्भुत क्षण जब आप अपना तकिया ठंडी तरफ पलट देते हैं।,1
"मुझे यकीन नहीं है कि वह समझ रहा है कि मैं किस बारे में बात कर रहा हूं....लेकिन...चूंकि मैं क्लीवेज दिखा रहा हूं, वह कम से कम सुन तो रहा है;D",1
मुझे फ्रिज के पास लंबी रोमांटिक सैर पसंद है। इसी तरह मैं अपने कर्व्स बनाए रखती हूं,0
"जब लोग कहते हैं कि बच्चों की उम्र एक साल के बाद महीनों में होती है तो मैं बर्दाश्त नहीं कर सकता। ""हाँ, वह 29 महीने का है"", B$tch मुझे गणित मत कराओ।",1
मैं अपने समाधि स्थल पर खुदे हुए 'काश तुम यहां होते' या 'तुम्हारे पीछे देखो' के बीच उलझा हुआ हूं।,1
जिसके पास भी मेरी वूडू गुड़िया है...कृपया मेरे कंधे के ब्लेड के बीच खरोंचें।,1
"हर किसी का एक परेशान करने वाला दोस्त होता है। यदि आपके पास कोई नहीं है, तो संभवतः वह आप ही हैं।",1
डरावनी फिल्मों के लोग अगर दर्शकों में मेरी बात सुनेंगे तो ज्यादा समय तक जीवित रहेंगे।,1
प्यार के चरण. 1) एक्सओएक्सओ। 2) xxx. 3) उदा.,0
जब लोग मेरे लिए हैप्पी बर्थडे गा रहे होते हैं तो मुझे समझ नहीं आता कि मैं कहां देखूं।,0
