Sentence,Tag
बिना खोल के कछुए को आप क्या कहते हैं? मृत।,1
पोकेमॉन मास्टर का पसंदीदा पास्ता कौन सा है? वार्टोर्टेलिनी!,0
जब अप्रैल में बारिश होती है तो मूल अमेरिकी इससे नफरत क्यों करते हैं? क्योंकि यह मेफ्लावर लाता है।,0
"मेरा वंश वृक्ष कैक्टस है, हम सभी कांटेदार हैं।",0
संगीत और कैंडी कैसे समान हैं? हम रैपर्स को फेंक देते हैं।,1
"मैंने अभी 5 साल का रिश्ता ख़त्म किया है, मैं ठीक हूँ, यह मेरा रिश्ता नहीं था :p",1
डेटिंग टिप: अपनी डेट को आश्चर्यचकित करें! एक दिन पहले आना.,1
आप एशियाई कुकिंग शो की व्याख्या को क्या कहते हैं? एक वॉक-थ्रू।,0
लिटिल मिस मफेट के टफेट पर जीपीएस क्यों लगा था? उसे अपना मट्ठा खोने से बचाने के लिए।,0
यदि आप काफी गुस्से में हैं तो सभी पैंट ब्रेकअवे पैंट हैं,0
"उह, मैंने अपने पेट के अंदर तक रेड वाइन गिरा दी।",0
यहूदियों की नाक बड़ी क्यों होती है? क्योंकि हवा मुफ़्त है,1
दिलचस्प तथ्य: साल 2020 तक अमेरिकी टीवी शो के सभी कलाकार ऑस्ट्रेलियाई होंगे।,0
मैं आपको एक रसायन विज्ञान चुटकुला सुनाऊंगा लेकिन मुझे पता है कि मुझे कोई प्रतिक्रिया नहीं मिलेगी,1
क्या आप जानते हैं दस्त आनुवंशिक है? यह आपके जीन्स में चलता है,1
"मेरे बेटे इबोला मजाक करते हैं कि अफ़्रीकी लोग नाश्ते में क्या खाते हैं? इबोला अनाज :) (दयालु बनें, वह केवल 14 वर्ष का है)",0
डिज़ायर नामक स्ट्रीटकार का विज्ञान-फाई रीमेक क्या था? अंतरराज्यीय,0
आप उन बर्बर लोगों के कबीले को क्या कहते हैं जिन्हें आप देख नहीं सकते? invisigoths,0
आपको कैसे पता चलेगा कि कोई रिकर्सन का उपयोग कर रहा है?,0
आपको पोकेमॉन के आसपास बदलाव क्यों नहीं करना चाहिए? क्योंकि वह चू पर नज़र डाल सकता है।,0
मुर्गी परिवार शनिवार की दोपहर को क्या करते हैं? वे पेक-निक्स पर जाते हैं!,0
जेसीपीनी और किशोरों में क्या समानता है? पैंट पर 50% की छूट,0
मेरे दिमाग में एक बातचीत चल रही है - ख़ुशी से झूम रहा हूँ,0
मैं वास्तव में अपने कुत्ते को हर 52 दिन में जन्मदिन का केक बनाकर परेशान कर चुका हूँ।,0
अंदर कौन है ? कपास ! कपास कौन? एक जाल बुनो!,0
आप उस काले आदमी को क्या कहते हैं जो हिच-हाइकिंग करता है? फंसे हुए!,0
"वे ऐसा क्यों कहते हैं कि सभी अल्पसंख्यक एक जैसे दिखते हैं? क्योंकि एक बार आपने जुआन को देख लिया, तो आपने जमाउल को भी देख लिया।",0
यो माँ कितनी बदसूरत है.. उसकी तस्वीरें खुद ही लटक जाती हैं,0
"पत्नी: तुम डिशवॉशर फिर से चलाना भूल गए क्या? मैं: नहीं, क्यों?",0
मेरा दोस्त वास्तव में गंभीर वियाग्रा की लत से जूझ रहा है। उसे इसमें कठिनाई हो रही है।,0
मैंने अपनी गर्लफ्रेंड का उपनाम मेलोडी रखा क्योंकि यह सबसे तेज़ और हमेशा शीर्ष पर रहता है,0
मेरा जीवन कैसा है? आइए बस कहें कि मैं बहुत सारे वाक्यों की शुरुआत आइए से शुरू कर रहा हूं।,0
जरा सोचिए कि प्रिस्क्रिप्शन पनीर कितना अच्छा होगा।,1
"पागल पूर्व गर्लफ्रेंड चॉकलेट के डिब्बे की तरह हैं, वे आपके कुत्ते को मार डालेंगे",1
क्या आपने द्वितीय विश्व युद्ध में उड़ने वाले जर्मन पैनकेक के बारे में सुना है? वे लूफ़्टवाफ़ल में थे!,0
यदि मैंने जीवन में दो चीजें सीखी हैं तो वह यह है कि मैं गिनती करने में बहुत कमजोर हूं।,1
कनाडाई सेना का प्रशिक्षण 6 सप्ताह का स्नोबॉल फेंकना सीखने का है।,1
पुलिस की गाड़ी के पीछे हमेशा काला क्या होता है? सीट।,1
समुद्र में पानी क्यों है? क्योंकि आसमान *नीला* है,0
मैं छुट्टियों के दौरान उदास हो जाता हूं क्योंकि वे मुझे हमेशा याद दिलाते हैं कि मेरा वजन कितना बढ़ जाएगा।,0
एक कवर बैंड शुरू करना जिसे एक किताब कहा जाता है ताकि कोई हमें जज न कर सके।,1
मेरी मुलाकात एक घोड़े से हुई जो सर्वनाश के बारे में बात करता रहता है। उसने मुझसे कहा कि अंत निकट है।,0
एक छात्र के रूप में सबसे अधिक सांत्वना देने वाले शब्द जो आपने कभी सुने होंगे वह यह है कि मैंने अभी शुरुआत भी नहीं की है,1
यदि आप सिंड्रेला को पीछे की ओर देखते हैं तो यह एक महिला को उसके स्थान पर रखे जाने के बारे में है।,0
"यदि आप किसी चीज़ से प्यार करते हैं तो उसे आज़ाद कर दीजिए, जब तक कि वह शेर न हो। ऐसा मत करो.",1
फ्रांस की किस सड़क पर हिरन रहते हैं? रुए डॉल्फ़,0
टाइम मशीनें आपको खुश क्यों करती हैं? वे वर्तमान-विरोधी हैं।,0
"12 इंच लंबा सफ़ेद बल्ब क्या है, फ्लोरोसेंट लाइट बल्ब नहीं? कुछ नहीं।",0
एसजेडब्ल्यू को बंदूकों से नफरत क्यों है इसका असली कारण क्या है? वे ट्रिगर चेतावनियों के साथ नहीं आते हैं।,0
प्रश्न: शतरंज के मास्टर को विदेशी महिलाओं में दिलचस्पी क्यों थी? उत्तर: वह एक चेक साथी चाहता था।,1
ओली ने स्टोर के बाहर मैनेजर को मदद के लिए क्यों बुलाया? घड़ी के लिए..,0
जेमी को लंबी घास में सेर्सी कैसे मिली? संतुष्टि देने वाला।,0
जब किसानों के लिए कोई चीज़ महत्वपूर्ण होती है तो वे क्या कहते हैं? यह एक बड़ा ट्रैक्टर बजाता है.,0
सेक्सी किसान पूरे दिन क्या कहते हैं? भूरी-मुर्गी-भूरी-गाय! और फिर वे थोड़ा लड़खड़ाते हैं।,0
स्टीफन हॉकिंग एक लंबे दिन के बाद कैसे तरोताजा हो जाते हैं? f5,1
जब सिम्बा अपने पिता से बहुत धीमी गति से चल रहा था तो उसने उससे क्या कहा? मुफ़ासा!,1
जब आप एक हाथी को गैंडे से पार कराते हैं तो आपको क्या मिलता है? एलिफिनो...,0
"समानांतर पार्क कैसे करें, इस पर चरण-दर-चरण मार्गदर्शिका! 1) कहीं और पार्क करें।",0
आप हेलन केलर को कैसे भ्रमित करते हैं? उसे एक बास्केटबॉल दें और उसे इसे पढ़ने के लिए कहें।,0
पीने के फव्वारे के पानी का स्वाद पैनी और मम्प्स जैसा होता है।,0
मैंने सुना है कि वे ड्राइव का एशियाई संस्करण बनाना चाहते थे लेकिन क्रैश नामक एक फिल्म पहले से ही मौजूद है।,1
एक कामुक समुद्री डाकू का सबसे बुरा सपना क्या है? बिना लूट का धँसा हुआ संदूक।,0
मेरी ब्रेड फ़ैक्टरी जल गई। अब मेरा व्यवसाय टोस्ट है.,1
"यदि समय समाप्त होने के बाद भी चादरें बिस्तर पर पड़ी रहती हैं, तो आप गलत कर रहे हैं।",0
स्ट्रिपर्स काफी हद तक चुम्बक की तरह होते हैं। वे डंडे से काम करते हैं.,0
मैं अब केवल स्मार्ट पानी पीता हूं। मुझे लगता है कि यह वास्तव में मेरे दिमाग को सोचने में मदद कर रहा है।,0
अपने छात्र ऋण के लिए मैं हमेशा आपका ऋणी रहूंगा।,1
क्या आपने ट्रांसजेंडर छात्र के बारे में सुना है? उन्होंने अपना कनिष्ठ वर्ष व्यापक रूप से बिताया।,0
क्या आप मुर्गी पालक हैं क्योंकि आप जानते हैं कि मुर्गा कैसे पालते हैं।,0
"तुम्हें पता है क्या दोस्त, अपने खुद के अंडे देना - जर्क चिकन",0
मुझे अपनी कार पसंद है और मुझे अपनी जिंदगी भी पसंद है। शुल्क मुक्त।,0
ट्विटर अभिजात वर्ग होना शरण में सबसे लोकप्रिय रोगी होने जैसा है।,0
अपनी प्रेमिका को छोड़ने के बाद नरभक्षी ने क्या किया? उसने पोंछ दिया.,0
गोल्डन गर्ल्स का रद्द होना शोल्डर पैड उद्योग के लिए विनाशकारी रहा होगा।,0
"क्या आपने स्टीव वंडर का नया घर देखा है? नहीं? अच्छा, यह सचमुच बहुत अच्छा है।",0
एट किसलिए छोटा है? क्योंकि उसके केवल छोटे पैर हैं,0
इसलिए मैंने आज कुछ कोहरा पकड़ने की कोशिश की... मुझे धुंध है।,0
बार्बी कभी गर्भवती क्यों नहीं हुई? क्योंकि केन एक अलग डिब्बे में आया था। बदम टिस.,0
"देखिए, मैं आस्ट्रेलियाई लोगों को बुला सकता हूं, क्या आपको कभी ऐसा महसूस हुआ है?",0
"मेरे परिवार में शराबी नहीं रहते, वे इधर-उधर लड़खड़ाते हैं और चीजों को तोड़ देते हैं",0
"क्या आपने उस आदमी के बारे में सुना है जिसका पूरा बायां हिस्सा काट दिया गया था? हाँ, वह अब बिल्कुल ठीक है",0
भूरा और चिपचिपा क्या है? (छड़ी नहीं) मेरा बेयॉन्से कैलेंडर,0
"एफ(एक्स) एक बार में जाता है, बारटेंडर उसे देखता है और कहता है, क्षमा करें, हम समारोहों की व्यवस्था नहीं करते हैं।",0
जब ओबामा ने डोनाल्ड ट्रम्प को राष्ट्रपति पद के लिए जीतते हुए सुना तो उनकी क्या प्रतिक्रिया थी?,0
दुनिया में सबसे निराशाजनक चीज़ क्या है?,0
आप उस गाय को क्या कहते हैं जिसने दूध देना बंद कर दिया है? थन की विफलता.,0
"एक कार में दो काले आदमी हैं, गाड़ी कौन चला रहा है? पुलिस",1
रसोइया जेल क्यों गया? अंडे फेंटने और क्रीम फेंटने के लिए!,0
प्रश्न: कीट को वन्यजीव अभयारण्य से बाहर क्यों निकाला गया? उत्तर: यह एक कूड़ा-कचरा था।,0
क्या आपने उस बच्चे के बारे में सुना है जिसका जन्म हाईटेक तरीके से हुआ है। अस्पताल? यह तार रहित निकला!,0
संता का बोरा इतना बड़ा क्यों है? क्योंकि वह साल में केवल एक बार सहता है!,0
क्या अभी तक किसी और की दुनिया ख़त्म हुई है? माया ने नहीं किया है.,0
आपका लंड इतना छोटा है कि आप इसका उपयोग दांत साफ़ करने के लिए कर सकते हैं।,0
कभी भी ऐसी महिला से शादी न करें जो वाद-विवाद दल की कप्तान हो।,0
क्या आपने पेलिकन के बारे में सुना है? इसका बिल इसके पेट की क्षमता से अधिक फिट बैठता है,0
ऑनलाइन डेटिंग के बारे में सबसे कठिन हिस्सा... किसी ऐसे व्यक्ति को ढूंढना जो आपके साथ क्लिक करे।,0
"मेरी माँ की कैंसर से मृत्यु हो गई थी... रुकिए नहीं, मेरे पिता धनु राशि के थे।",0
मुझे अपने चुटकुले मेरी कॉफ़ी ब्लैंड की तरह पसंद हैं,0
पोप की कार पर लगे बुलेट प्रूफ़ शीशे की तरह कोई भी चीज़ यह नहीं कहती कि मुझे ईश्वर पर भरोसा है।,0
आप अंतरिक्ष पार्टी का आयोजन कैसे करते हैं? आप ग्रह ;),0
"डार्लिंग, तुम इस पार्टी की सबसे खूबसूरत महिला हो! क्या आपने इन मेहमानों को जानबूझकर आमंत्रित किया?",0
नाइट ने इंटरनेट का उपयोग क्यों बंद कर दिया? क्योंकि वह चेनमेल से बीमार था।,0
तुम मेरी जिंदगी की नजरों में शैम्पू हो।,0
"ट्विटर से पहले, मशहूर हस्तियाँ महीनों-महीनों तक पूरी तरह से किसी का ध्यान नहीं जाती थीं।",0
सप्ताहांत अखबार की हेडलाइन में चार मैक्सिकन डूब गए: क्वात्रो सिंको,0
"मैं हमेशा सोचता था, अरे, कम से कम हवा तो मुफ़्त है...जब तक मैंने चिप्स का एक बैग नहीं खरीदा।",1
एक लाइटबल्ब को बदलने में कितने बच्चों की आवश्यकता होती है? बाइक चलाने जाना चाहते हैं?!?,0
"मैं हमेशा आत्मविश्वासी रहना चाहता था। अच्छा, अब मुझे देखो. वास्तव में, मत करो.",0
"मेरी गर्लफ्रेंड के पास एक फायर क्रॉच है। या जैसा कि वैज्ञानिक रूप से ज्ञात है, क्लैमाइडिया।",0
समलैंगिक लोग घूमने-फिरने में इतने अच्छे क्यों होते हैं? वे अपना सामान पैक करने के आदी हैं,1
आप अमीर मेंढक को क्या कहते हैं? सोने के खून वाला सरीसृप।,0
आपकी कुछ टाइमलाइनें मेरे सुबह के अखबार हैं।,1
मोटे व्यक्ति को कैसे आकर्षित करें? तुच्छ बात,1
मुझे आशा है कि गूगल स्ट्रीट व्यू पर इस तीर पर तेजी से क्लिक करना जॉगिंग के रूप में गिना जाएगा।,0
अपने फ़्लू शॉट के लिए डॉक्टर के कार्यालय में गया। उसने वादा किया कि इससे दर्द नहीं होगा... असंवेदनशील चुभन।,0
क्या आपने कभी मोथबॉल को सूंघा है? आपने उनके छोटे पैर अलग कैसे किये?,0
मैं हमेशा यह सुझाव देकर मित्र समूहों को बर्बाद कर देता हूं कि हम बहुत जल्दी एक बैंड शुरू कर दें,0
खरगोश पर ऑपरेशन को आप क्या कहते हैं? एक खरगोश-कट।,0
गंजे लोगों के बारे में मत भूलिए जो अपनी दाढ़ी के जरिए परोक्ष रूप से रहते हैं।,0
मुर्गी ने मोबियस पट्टी क्यों पार की? उसी तरफ जाने के लिए.,0
यहां आपके लिए कुछ सलाह है. सलाह.,0
काउंसलर ने होलोग्राम पर क्या कहा? आप प्रक्षेपण कर रहे हैं. (स्टार ट्रेक वोयाजर से),0
"69 सेक्स का आत्मघाती है। अगर मैं नीचे जा रहा हूं, तो तुम मेरे साथ आ रहे हो।",0
ड्रैकुला का पसंदीदा हलवा क्या है? जोंक और चीख.,0
तेज रफ्तार यात्री से डॉक्टर ने क्या कहा? आपके मरीज़ों के लिए धन्यवाद.,1
"मैं एक ऑर्थोडॉन्टिस्ट का वकील हूं, उसने मुझे रिटेनर पर रख लिया है।",0
क्या आपने उन पक्षियों के बारे में सुना है जो पानी पीने के लिए बाहर जाना चाहते थे? वे क्राउबार पर समाप्त हुए।,0
मुझे खेद है कि मैं इंटरनेट के कारण आज रात बाहर नहीं जा सकता।,0
मैं कोई स्त्री रोग विशेषज्ञ नहीं हूं... लेकिन मैं देख सकती हूं।,0
मृत्युदाता बनना अच्छा होगा... लोग आपसे मिलने के लिए हमेशा उत्सुक रहते हैं।,0
आप उत्तरी ध्रुव पर मुर्गे को क्या कहते हैं? खो गया।,1
मेरे द्वारा पढ़ी गई सभी नैन्सी ड्रू पुस्तकों को गुडरीड्स पर रेटिंग देने से ऐसा लगता है कि मैं स्मार्ट हूं या कुछ और।,0
हम क्या चाहते हैं? क्लिकबेट हमें यह कब चाहिए? जवाब आपको चौंका देगा.,0
