Sentence,Tag
"आयरलैंड खूबसूरत भी है और ख़राब भी, वहां आयरिश लोग रहते हैं",0
पैसा :::: मनुष्य ही एकमात्र ऐसी प्रजाति है जिसे पृथ्वी पर रहने के लिए भुगतान करना पड़ता है..,0
मैं हाल ही में बहुत अधिक थ्रीसम कर रहा हूं। जब से मेरी पत्नी गर्भवती हुई है.,1
"आप एक मूर्ख, गंवार, अनाकर्षक और अशिक्षित व्यक्ति को कैसे फाँसी पर लटकाए रख सकते हैं?",0
यदि डोनाल्ड ट्रम्प एक फल होते तो वह क्या होते? एक अखरोट.,0
"धार्मिक? हाँ, मैं बहुत धार्मिक हूँ, मैं हमेशा बीब्ले पढ़ता रहता हूँ",1
मुझे लगता है कि हर आदमी अपने लिए यह कहावत सैंडविच बनाते-बनाते थक गई महिलाओं द्वारा बनाई गई थी,0
एमएलपी के लिए चीज़ रखने वाले पुलिसकर्मी को आप क्या कहते हैं? एक चपटा सिपाही.,0
क्या आपने टेक्सास में तीन जल निकायों के बारे में सुना है? अच्छी तरह से अच्छी तरह से अच्छी तरह से...,0
संता के पास इतना बड़ा बोरा क्यों है? क्योंकि वह साल में केवल एक बार आता है,1
मुझे लगता है कि मुझे दर्पण साफ करने का काम चाहिए। यह कुछ ऐसा है जिसे मैं वास्तव में खुद को करते हुए देख सकता हूं।,1
"तिल, /r/चुटकुलों पर 23% से अधिक चुटकुले पिछले चुटकुलों की नकल मात्र हैं... गलत उप( )",0
सैमसंग अपने सबसे वफादार ग्राहकों को कैसे जानता है? वे बर्न वार्ड से जांच करते हैं। (मुझे मेरा कोट मिलेगा),0
भारतीय व्यक्ति पेट दर्द की शिकायत लेकर डॉक्टर के पास गया। उसके पास हिंदी भाषा थी।,0
आप उस क्षेत्र को क्या कहते हैं जहाँ घोड़ा रहता है? पड़ोस,0
"मेक्सिको का झंडा हरा, सफ़ेद और लाल क्यों है? गुआकामोल, खट्टा क्रीम, और साल्सा।",1
व्हिटनी ह्यूस्टन का पसंदीदा प्रकार का समन्वय क्या है? हाथ आँख,0
"एक फेसबुक कर्मचारी एक दूसरे का अभिवादन कैसे करता है? अरे, व्हाट्सएप!!",1
घड़ी को कैंसर कैसे हुआ? दूसरे हाथ में सिगरेट!,0
"मैंने कल अपने घर पर एक सोलिप्सिस्ट पार्टी रखी, सभी लोग वहां मौजूद थे।",0
किसी पुतले को 'एक्सक्यू मी' कहने से ज्यादा हतोत्साहित करने वाली कुछ बातें होती हैं।,1
जिमनास्ट और स्नातक छात्र में क्या समानता थी? दोनों पर बकाया था।,0
क्या आपने सुना कि लिथियम का क्या हुआ? उन्हें बैटरी चार्ज के आरोप में गिरफ्तार किया गया था। कुछ लोग कहते हैं कि वह द्वि-ध्रुवीय है।,0
आप एक हिप्स्टर को कहाँ डुबाते हैं? मुख्यधारा में,0
वह आदमी बनने का प्रयास करें जिससे आप अपनी बेटी की शादी कराना चाहते हैं ~ वुडी एलन,0
प्रसिद्ध साँप कहाँ जाते हैं? हिस्सस्टोरी में नीचे!,1
यह आश्चर्यजनक है कि कैसे दयालुता का एक साधारण कार्य मेरे बुरे मूड को एक संदिग्ध बुरे मूड में बदल सकता है।,0
"मुझे सड़क पर शतरंज खेलने के कारण गिरफ्तार कर लिया गया.. मैंने कहा कि ऐसा इसलिए है क्योंकि मैं काला हूं, है ना",1
"वॉन्टन सूप का वजन कितना होता है? एक टन, लेकिन मैं किसी ऐसे व्यक्ति को नहीं जानता जो इसे स्वेच्छा से ऑर्डर करेगा।",0
यदि आपको मेरे द्वारा उन्हें ठोकर मारने पर कोई आपत्ति नहीं है तो मुझे आपके बुरे बच्चों के इधर-उधर भागने पर कोई आपत्ति नहीं है।,1
"हर किसी को आश्चर्यचकित करने के लिए पारदर्शी, स्पष्ट प्लास्टिक हैंग ग्लाइडर का उपयोग क्यों न करें?",0
मनुष्य को जानवरों से क्या अलग करता है? डोनाल्ड ट्रंप के मुताबिक वह जो दीवार बनाने जा रहे हैं.,1
जब बौने फुटबॉल खेलते हैं तो वे क्यों हंसते हैं? क्योंकि जब वे दौड़ते हैं तो घास उनकी गेंदों को गुदगुदी करती है।,1
"मैं एक शाकाहारी बूचड़खाने में गया। यार, हर जगह रस था!",0
यदि आप ईमानदारी से सोचते हैं कि मैं आपके सपने के विवरण के बारे में सुनना चाहता हूँ तो आप अभी भी सपना देख रहे हैं।,1
जब आप एक कमरे में 32 रेडनेक्स रखते हैं तो आपको क्या मिलता है? दांतों का एक पूरा सेट.,0
मैं अपनी महिलाओं को वैसे ही पसंद करता हूं जैसे मुझे अपनी कॉफी पसंद है: जब मैं गाड़ी चला रहा होता हूं तो वह मेरी गोद में होती है।,0
जब विंसेंट किसी पर क्रोधित होता है तो वह क्या कहता है? भाड़ में जाओ गॉग,0
इस दुनिया में 10 तरह के लोग हैं... ...वे जो बाइनरी समझते हैं और वे जो नहीं समझते,1
क्या आपने आत्मघाती बम विस्फोट शिविर के बारे में सुना है? मैंने सुना है यह एक विस्फोट था.,1
अब्राहम लिंकन ट्रेंडिंग है. उनकी सोशल मीडिया टीम को बधाई।,0
"जब तक आपको आग न लगी हो तब तक धूम्रपान न करें, यह स्वाभाविक है।",0
"एक लाइटबल्ब को खराब करने में कितने कम्युनिस्ट लगते हैं? सोवियत रूस में, लाइटबल्ब आपको खराब कर देता है!",1
अगर सेक्सी होना कोई अपराध है तो मैं ऐसा अपराध नहीं कर रही हूं।,1
आखिर लड़की के चेहरे पर निंजा जिज़ कैसे आया? उसने उसे आते नहीं देखा,0
घोड़े को तलाक क्यों मिला? इसका कोई स्थिर संबंध नहीं था।,0
"लोग कहते रहते हैं कि मुझे और अधिक मुखर होने की आवश्यकता है, क्या यह ठीक है?",0
आप मर्सिडीज़ में कैसे फिट हो सकते हैं? कुछ हजार. वे सभी ऐशट्रे में फिट हो जाते हैं,0
नूह अपनी मधुमक्खियों को कहाँ रखता है? सन्दूक-छत्ते.,0
लड़कियाँ सर्दियों में स्कर्ट क्यों नहीं पहनतीं? उनके होंठ फट जाते हैं,1
फेसबुक: एकमात्र स्थान जहां आप तब उत्साहित हो जाते हैं जब अजनबी आपका पीछा करते हैं।,0
मेरे पड़ोसी बढ़िया संगीत सुन रहे हैं... ...चाहे उन्हें यह पसंद हो या नहीं!,1
पोलैंड में छुट्टियों पर जाएं... ...आपकी कार पहले से ही वहां मौजूद है!,0
कुत्ता चर्च में क्यों गया? किवाड़ खुले हुए थे।,1
प्रश्न: क्राउबार क्या है? ए: एक जगह जहां कौवे पानी पीने के लिए जाते थे!,1
यीस्ट संक्रमण वाली एनोरेक्सिक लड़की को आप क्या कहते हैं? पनीर के साथ चौथाई पाउंडर,0
यदि मेरे पास हर बार झटके के लिए एक पैसा होता... तो मैं अरबपति बन जाता!,0
एक लड़का अपनी मधुमेह संबंधी प्रेमिका को क्या कहता है? मीठी मटर,0
हम एक आदमी को चंद्रमा पर भेज सकते हैं लेकिन ___________ (वह मुद्दा डालें जो बहुत अलग है),0
"कृपया क्रिसमस में क्राइस्ट को रखें, क्योंकि हैलोक्रिस्टवीन अजीब होगा।",0
एक नस्लवादी चुटकुला सुनना चाहते हैं? आपको शर्म आनी चाहिए,1
केवल 5 दिन बचे हैं जब फेसबुक जिम में वापसी की स्थिति और सलाद की तस्वीरों से भरा पड़ा है।,0
बारटेंडर ने जम्पर केबल से क्या कहा? बेहतर होगा कि आप कुछ भी शुरू करने की कोशिश न करें।,0
क्या आपको जर्मन सॉसेज के बारे में चुटकुलों से नफरत नहीं है? वे सबसे बुरे हैं!,0
दो कलाकारों के बीच एक कला प्रतियोगिता थी... यह बराबरी पर समाप्त हुई,0
मुर्गे ने खेल का मैदान क्यों पार किया? दूसरी स्लाइड पर जाने के लिए.,0
मूस का शिकार करने के लिए आप किस बंदूक का उपयोग करते हैं? एक मूसकट!,1
"यदि जीवन आपको खरबूजे देता है, तो आपको डिस्लेक्सिया हो सकता है।",1
टूटी हुई पेंसिलें... ...व्यर्थ हैं।,0
एक हिममानव ने दूसरे हिममानव से क्या कहा? 'क्या तुम्हें गाजर की गंध आती है?',1
एक लाइटबल्ब को बदलने में कितने हिप्स्टर लगते हैं? यह सचमुच एक अस्पष्ट संख्या है. आपने शायद इसके बारे में कभी नहीं सुना होगा.,0
बीमार नावें कहाँ जाती हैं? डॉक!,1
मुझे अपने गुलाम वैसे ही पसंद हैं जैसे मुझे अपनी कॉफी पसंद है: मुफ़्त।,1
"मेरी प्रेमिका ने मुझे बताया कि वह मुझे छोड़ रही है क्योंकि मैं ट्रांसफार्मर होने का नाटक करता रहता हूँ... मैंने कहा, नहीं, रुको! मैं बदल सकता हूं!",1
"पुरानी चीनी कहावत: जो आदमी सात दिनों में नहीं नहाता, वह दुर्गंधयुक्त हो जाता है।",1
"ब्राउनी फैक्ट्री के मालिक ने क्या कहा जब उसकी फैक्ट्री में आग लग गई? ""मैं ठग को यहाँ से निकाल रहा हूँ!""",0
किस प्रकार का विकिरण आपके लिए कुकीज़ बनाता है? एक व्याकरण किरण,0
"मधुमक्खी चुटकुले, मेरी भतीजी (उम्र 8) के सौजन्य से। तैरने के बाद मधुमक्खी सूखने के लिए क्या उपयोग करती थी? एक *मधुमक्खी*च तौलिया. उलझनों को दूर करने के लिए मधुमक्खी ने क्या प्रयोग किया? एक मधुकोश.",1
सबसे तेज़ आर्थिक प्रणाली कौन सी है? पूंजीवाद,0
"मैं आज एक नौकरी के लिए इंटरव्यू देने गया... साक्षात्कारकर्ता ने मुझसे कहा, आप क्या कहेंगे कि आपकी सबसे बड़ी कमजोरी क्या है? मैंने कहा, मुझे लगता है कि मुझे कहना होगा कि मेरी सुनने की क्षमता ही मेरी सबसे बड़ी ताकत है।",1
वह शूरवीर कौन था जिसने गोल मेज़ का आविष्कार किया था? सर कम्फरेंस. (उस मित्र के माध्यम से जिसे यह एपकॉट के इंग्लैंड क्षेत्र में एक सड़क प्रदर्शन समूह से मिला था),1
द्वितीय विश्व युद्ध के दौरान जर्मन वायु सेना ने नाश्ते में क्या खाया? लूफ़्टवाफ़ल्स,0
"मैंने कल एक घोंघे का खोल खोल दिया... आपको लगता होगा कि यह तेजी से आगे बढ़ेगा, लेकिन यह वास्तव में थोड़ा सुस्त था।",1
"अंक शून्य ने अंक आठ से क्या कहा? ""अच्छा कमरबंद।""",1
पैरों में दर्द वाले सेंटीपीड से बुरा क्या हो सकता है? गले में ख़राश वाला जिराफ़,1
आपके दांतों के लिए क्या लाल और हानिकारक है? एक ईंट।,1
मुर्गे ने खेल का मैदान क्यों पार किया? दूसरी स्लाइड पर जाने के लिए,0
क्या आपने उस फ्रांसीसी शेफ के बारे में सुना जिसने आत्महत्या कर ली? उसने हुइले डी'ओलिव को खो दिया,0
"बेरोजगार लोगों के बारे में एक चुटकुला सुनना चाहते हैं? कोई बात नहीं, वे काम नहीं करते.",1
"खट-खट, वहां कौन है बू!! बू कौन? रोओ मत, यह सिर्फ एक मजाक है",0
स्केलेटन ने अपनी उत्कृष्ट कानूनी सेवाओं के लिए कितना शुल्क लिया? एक बांह और एक टांग।,1
गोरिल्लाओं की नाक इतनी बड़ी क्यों होती है? क्योंकि उन्हें बड़ी उंगलियां मिलीं।,1
साइबेरियन हस्की और अलास्का हस्की के बीच क्या अंतर है? लगभग 1500 मील.,1
शाकाहारी लाश क्या खाते हैं? GRAAIIINSSS!,0
थाई पुरुष और थाई महिला में क्या अंतर है? कृपया मदद करें.,1
आप उस कार को क्या कहते हैं जो अन्य कारों को खा जाती है? एक मांसाहारी.,1
यदि एक में छेद हो जाए तो गोल्फर ने दो जोड़ी पैंट क्यों पहनी?,0
एक ओलंपिक जिमनास्ट एक बार में आई... उसे कोई पदक नहीं मिला...,1
एक मैक्सिकन जादूगर नाश्ते में क्या बनाता है? टोस्ट-ताह-दाह!,1
बॉन्ड खलनायकों को सर्दियों में ठंड क्यों नहीं लगती? क्योंकि वे मांदों में कपड़े पहनते हैं.,0
"जब बूट उसके सुरक्षात्मक गुंबद के ऊपर से गुजरा तो मूर्ति ने क्या कहा? ""वह एक क्लॉच कॉल थी!""",0
कार्ल सागन का पसंदीदा पेय कौन सा था? कास्मोस \ ब्रह्मांड।,1
बहुत सारे कुत्ते रखने का चिकित्सीय शब्द क्या है? [ए रोवरडोज़],1
अंदर कौन है? मैंने किया. मैंने ऊपर किया-कौन?,0
मुझे अपने चुटकुले वैसे ही पसंद हैं जैसे मुझे अपने रोबोट पसंद हैं। हत्यारा।,1
शर्लक होम्स किस प्रकार के स्कूल में गए थे? प्राथमिक :),1
मेरे मित्र ने पुलिस तलाशी के बारे में एक बेतुका चुटकुला सुनाया। लेकिन मुझे नहीं लगता कि इसकी कोई आवश्यकता थी।,0
"दलाई लामा एक पिज़्ज़ा स्टोर में जाते हैं... और कहते हैं, ""क्या आप मुझे हर चीज़ से एक बना सकते हैं?""",0
पिशाच ने माउथवॉश का उपयोग क्यों किया? क्योंकि उसकी सांसें चमगादड़ की थीं,1
"जब मकई को पूरक बनाया गया तो उसने क्या कहा? ओह, बकवास!",0
"हरे अंगूर ने बैंगनी अंगूर से क्या कहा? - ""साँस लो, बेवकूफ!""",0
पतझड़ अन्य सभी ऋतुओं से अलग क्यों हो गया? क्योंकि यह शरद ऋतु चाहता था,1
"अगर मैं कभी किसी ऐसे व्यक्ति को नौकरी से निकाल दूं जो टेलर स्विफ्ट का प्रशंसक है तो मैं कहूंगा, ""जब आप आए थे तो मुझे पता था कि आप परेशानी में थे।""",1
यदि आप जिस सड़क पर गाड़ी चला रहे हैं उसके बीच में एक गाय हो तो आप क्या करते हैं? दूर रहना,1
"आप अंधे, बिना पैर वाले हिरन को क्या कहते हैं? कोई आंख-मिचौली नहीं. संपादित करें: मैंने इस मजाक को पूरी तरह से गड़बड़ कर दिया है। कृपया मुझे किसी अन्य चुटकुले के साथ एक और मौका दें?",1
"उन महिलाओं के लिए आपको क्या मिलता है जिनके पास सब कुछ है? तलाक, तो उसके पास हर चीज़ का केवल आधा हिस्सा होगा।",1
वहाँ एक उदास सॉसेज था... उसने सोचा कि उसका जीवन सबसे बुरा था।,0
कुत्ते के परिवहन का पसंदीदा साधन क्या है? एक वैगिन',1
रेत का टीला क्यों शरमा गया? क्योंकि समुद्री घास,0
अत्याचारी आड़ू का क्या हुआ? उन पर महाभियोग चलाया गया!,0
हाथी अपने पैर के नाखूनों को लाल रंग से क्यों रंगते हैं? इसलिए वे चेरी के पेड़ों में छिप सकते हैं। क्या आपने कभी चेरी के पेड़ पर हाथी देखा है? *तब यह काम कर रहा है*।,1
मैक्सिकन फायरचीफ़ ने अपने बच्चों का नाम क्या रखा... होज़ ए और होज़ बी,1
"जर्मन भौतिकशास्त्री अपनी बियर पीने के लिए क्या प्रयोग करते थे? आइंस्टाइन। - बिग नैट से, जैसा कि मेरे बच्चे ने बताया था।",0
