Sentence,Tag
अमेरिका के आधे से ज्यादा लोग क्या करते हैं? जनसंख्या समलैंगिक विवाह पर विचार करती है? अभी भी पहचान में नहीं आ रहा है,0
वह: जब तुम्हें अपना सामान मिल जाए तो मुझे बताना। मैं: तो मुझे लगता है कि यह अलविदा है।,0
आप एक स्विमिंग पूल से 50 कनाडाई लोगों को कैसे बाहर निकालते हैं? कृपया स्विमिंग पूल से बाहर निकलें,0
आप उस आलू को क्या कहेंगे जो नई चीज़ों को आज़माने में अनिच्छुक है? एक झिझकनेवाला,0
यहां एक औसत eli5 पोस्ट के बारे में मेरी धारणा है। eli5 आप eli5 में कैसे पोस्ट करते हैं?,0
शेक्सपियर समलैंगिक थे... और वह अपनी जीभ के मामले में इतने अच्छे कैसे थे?,0
बस किसी को धन्यवाद लिखा। मैं कौन हूँ? स्कूबी डू?,0
गायें हमेशा टूटी हुई क्यों होती हैं? किसान उन्हें सूखा दूध देते हैं।,0
"तो मेरी मुलाकात एक शाकाहारी से हुई। मैं मजाक ख़त्म कर दूंगा, लेकिन वह अभी भी बात कर रही है।",0
आप दो भेड़ों वाले रेडनेक को क्या कहते हैं? दलाल,0
स्टार्लिंग और स्वैलोज़ में क्या अंतर है? तुम्हारी माँ भूखे नहीं रहती.,0
मुझे अपनी प्रेमिका को क्रिसमस के लिए एक प्लंजर खरीदना चाहिए क्योंकि उसे पुरानी बातें उठाना पसंद है।,1
समलैंगिक एशियाई पुरुष शयनकक्ष में क्या करते हैं? वे बैंकॉक,0
पिज़्ज़ा रोल बौने लोगों के लिए बस गर्म जेब हैं,0
"पिताजी: मुझे बहुत भूख लगी है. मैं: हाय, मुझे बहुत भूख लगी है बेटा! *पिताजी बहुत धीरे-धीरे सिर घुमाते हैं*",0
"एक बार जब आप लेस्बियन हो जाती हैं, तो कभी-कभी आप वापस भी चली जाती हैं।",0
यीशु वास्तव में क्या करेंगे? शायद नेल गन पर प्रतिबंध लगा दें,1
"हर कोई वांछित होना चाहता है, शायद भगोड़ों को छोड़कर।",0
क्रिसमस तक 59 दिन. बेहतर होगा कि मैं बत्तियाँ सुलझाना शुरू कर दूँ।,0
"वह क्या है जो छोटा, हरा और सूअर के मांस जैसी गंध वाला है? मेंढक डिक केर्मिट!",0
द्वितीय विश्वयुद्ध में जर्मनी को हराने में अमेरिकियों को इतना समय क्यों लगा? वे रूसी नहीं थे.,0
मेरी पसंदीदा पंचलाइन वह चुटकुला है जो मैं अंधे लोगों को सुनाता हूं। वे इसे कभी आते हुए नहीं देखते।,1
रे चार्ल्स और रे राइस में क्या अंतर है? रे चार्ल्स एक बार हिट होने वाला आश्चर्य नहीं था।,0
गर्भ प्राप्त करो! - जब मैं दो बच्चों को संभोग करते हुए देखता हूं।,1
"बिना हाथ-पैर वाली नारीवादी को आप क्या कहेंगे? अच्छे स्तन, कुतिया।",0
अगर मैं दोनों हाथों से हस्तमैथुन करूँ तो क्या इसे त्रिगुट माना जाएगा?,0
"मेरे आत्म-जागरूक मित्रों को चिल्लाओ, तुम जानते हो कि तुम कौन हो",0
हिप्स्टर ने अपनी उंगलियाँ क्यों जला लीं? क्योंकि उसने बल्ब ठंडा होने से पहले ही बदल दिया था,1
मुझे बताया गया है कि मैं कृपालु हूं। (इसका मतलब है कि मैं लोगों से नीचे बात करता हूं।),0
सफल जीवन वाले किसी व्यक्ति को आप क्या कहते हैं? निश्चित रूप से मैं नहीं.,0
तो वे मेरे पड़ोस में क्रैक बेच रहे हैं... अंततः,0
महिला: वह बहुत रहस्यमय है महिला2: मुझे आश्चर्य है कि वह क्या सोच रहा है,0
मैं शर्मनाक तरीके से तेजी से या तीन दिन बाद वापस संदेश भेजता हूं और बीच में कोई नहीं है,0
यदि वह डेनियल डेव लुईस के पास जाता तो वह कम दिखावा करता।,0
365 प्रयुक्त रबर से आप क्या समझते हैं? इसे टायर में बदलो और इसे एक अच्छा वर्ष कहो।,0
शराब और मौज-मस्ती!' 'चेतावनी: शराब का सेवन आपको यह विश्वास दिला सकता है कि आप अदृश्य हैं।,0
एक जोड़ी कच्छा और एक सस्ते होटल में क्या समानता है? कोई बॉलरूम नहीं.,1
एकमात्र मुड़ी हुई सीधी रेखा कौन सी है? निःसंदेह यह एक दिशा है।,0
रूढ़िवादी समलैंगिक पुरुष रूढ़िवादी तरीके से वोट क्यों करते हैं? वे हथियार रखने का अधिकार अपने पास रखना चाहते हैं।,0
"एक घड़ी ने एक किताब लिखी, आलोचक कहते हैं कि यह समय के बारे में है",1
"यदि कोई आपको खुली ज़िपर के साथ देखता है, तो गर्व से उत्तर दें: पेशेवर आदत।",0
आप महिलाओं के एक समूह को कैसे चुप कराते हैं? अपना कैमरा बाहर लाओ.,0
भगवान ने उस पनीर से क्या कहा जिसने पाप किया? गौडा नरक.,0
जेडी का वोदका का पसंदीदा ब्रांड कौन सा है? आसमानी. केवल सिथ पूर्ण रूप से सौदा करता है।,0
मैं कल रात एक ट्रांसफार्मर में बदल गया... और लड़का मेरी बाहों के टायर हैं,0
"मैं एक पैराप्लेजिक फंडरेजर के पास गया, वहां बहुत सारी चीजें रेंग रही थीं",1
"क्या होगा अगर देजा वू का मतलब है कि आपने एक जीवन खो दिया है, और आप बस अपने आखिरी चेकपॉइंट पर वापस शुरू कर रहे हैं?",0
हाथी के स्वेटर के ऊपर खरगोश को आप क्या कहते हैं? भीगी बिल्ली !,0
बेकर्स के हाथ भूरे क्यों थे? क्योंकि वह गंदगी सान रहा था,0
"डलास पुलिस भर्ती कर रही है, शुक्रवार की सुबह तक उनके पास भरने के लिए 5 पद हैं",0
"2 एशियाई बार में प्रवेश करते हैं, बर्मन पूछता है कि एक ही चेहरा क्यों!",0
मैंने एक महिला मॉडरेटर से पूछा कि मैं r/jokes पर चित्र क्यों पोस्ट नहीं कर सकता... मेरा एक बॉयफ्रेंड है!,0
ब्राज़ील विश्व कप क्यों हार गया? कमजोर पीठ.,0
जब एक रसायनज्ञ अम्ल में पानी डालता है तो वह क्या कहता है? आधार गिराएं।,0
यदि आप इसे गेटवे में खड़े होकर करते हैं तो कोई भी दवा गेटवे ड्रग है,0
"फजीता पूप, फजिता पूप! तेरे छींटे कितने भयानक हैं!",0
मैं अपने दो साल के बच्चे को मुद्रा के बारे में सिखा रहा हूं ताकि मैं यह पता लगा सकूं कि उसने अभी कौन सा सिक्का निगला है।,0
आप रैप करने वाले पिता को क्या कहते हैं? (आर/डैडजोक्स से एक्स-पोस्ट) एक हिप पॉप। पिता दिवस की शुभकामना!,1
"जिस चीज़ पर आप विश्वास करते हैं उसके लिए खड़े होने से न डरें, भले ही इसका मतलब अकेले खड़े रहना हो।",0
अब आप बिना लपेटी हुई कैंडी खरीद सकते हैं और इसे खाने के लिए किसी भी प्रयास से बच सकते हैं। यूएसए! यूएसए!,0
पति: क्षमा करें. वह किसी और के पास जाने के लिए था।,0
इंदिरा गांधी को सम 4 सिखों पर बोगी से भी बदतर किस बात से नफरत थी,0
मुझे आश्चर्य है कि लिंकन को यह निर्णय लेने में कितना समय लगा कि केवल 87 वर्ष कहना पर्याप्त नहीं है।,0
"विमान उड़ाने वाले काले व्यक्ति को आप क्या कहते हैं? एक पायलट, तुम नस्लवादी कमीने हो।",0
एक दीवार ने दूसरी दीवार से क्या कहा? चलो कोने में मिलते हैं.,1
कैलकुलेटर बाहर से बदसूरत हो सकता है लेकिन अंदर जो है वह मायने रखता है।,0
हाथी ने नग्न आदमी से क्या कहा? आप उससे कुछ भी कैसे उठाते हैं?,0
"दो लोगों ने एक कैलेंडर स्टोर से एक कैलेंडर लूटने का फैसला किया, जिनमें से प्रत्येक को छह महीने का समय मिला था",0
आप पीछे की ओर चलने वाले दस खरगोशों को क्या कहते हैं? एक घटती हुई खरगोश रेखा!,0
"पोकर सेक्स की तरह है, अगर इसमें बहुत सारे फोल्ड हों तो इसे देखना मजेदार नहीं है",0
क्या आपने यीस्ट संक्रमण से पीड़ित महिला का मासिक धर्म का वीडियो देखा? यह खून जमा देने वाला था।,0
महात्मा गांधी का एक प्रसिद्ध उद्धरण इतिहास उन लोगों द्वारा नहीं बनाया गया है जो गुप्त मोड में ब्राउज़ करते हैं,0
सौर मंडल में एक पार्टी कैसे होती है? वे ग्रह,0
दो मूँगफली सेंट्रल पार्क में घूम रहे हैं। एक नमकीन था.,0
क्या सोच रहे हैं डोनाल्ड ट्रंप? यदि हम सभी मेक्सिकन लोगों को निर्वासित कर दें तो दीवार कौन बनायेगा?,1
"यदि आप किसी को क्रॉसवर्ड पहेली बनाते हुए उसके कान में फुसफुसाते हुए देखते हैं, तो 7 अप नींबू पानी है।",0
कैन क्रशर को अपने काम से नफरत क्यों थी? क्योंकि यह सोडा प्रेसिंग था,0
"मेरा घर वैलेंटाइन कार्डों से भरा है। मैं एक किंवदंती नहीं हूं, हालांकि सिर्फ एक आलसी डाकिया हूं",0
आप कवचधारी डाकू को क्या कहते हैं? शूरवीर में एक चोर,0
"जब तक आप संतुष्ट नहीं हो जाते, मैं अंदर सरकता रहूंगा और आगे-पीछे होता रहूंगा -फ्लॉस",0
हमारे वॉलमार्ट में मैकडॉनल्ड्स और ब्लड प्रेशर मशीन दोनों हैं। जीवन का चक्र।,1
चिकन ने सड़क को पार क्यों किया? क्योंकि उत्तर कोरिया के परमाणु हथियार वहां तक नहीं पहुंच सके,0
किस प्रकार की मछली सबसे खराब मित्र होती है? सेल-मछली,0
मैं सामान्यतः यौन रूप से ही नहीं बल्कि जीवन में भी चीखने-चिल्लाने वाला हूं,0
"आप विमान उड़ाने वाले काले व्यक्ति को क्या कहते हैं? एक पायलट, तुम नस्लवादी हो।",0
समुद्री डाकू का पसंदीदा पत्र कौन सा है? अर्र्रर्रर्रग दोस्त यह सी हो सकता है।,0
"मैंने स्तंभन दोष से पीड़ित लोगों के लिए एक क्लब शुरू किया है, हम अपनी सदस्यता बढ़ाने की कोशिश कर रहे हैं",0
आप एक भयानक फ्रेंच पेस्ट्री शेफ को क्या कहते हैं? एक क्रेप.,0
अलबामा में शादियाँ इतनी छोटी क्यों होती हैं? उन्हें केवल एक परिवार को आमंत्रित करना होगा,1
एक बौनी के साथ बलात्कार करने का सबसे अच्छा हिस्सा क्या है? उनकी भुजाएँ आपको रोकने के लिए बहुत छोटी हैं।,0
क्रिसमस पर एक क्रोधी भेड़ क्या कहती है? ...बाआआहहम्बग,0
क्या आपने कभी उत्तर कोरियाई खाना खाया है? नहीं? उनके पास भी नहीं है.,1
जब बूगीमैन रात को सोने जाता है तो वह चक नॉरिस के लिए अपनी अलमारी की जाँच करता है।,0
नारीवादी और बंदूक में क्या अंतर है? बंदूक में केवल एक ट्रिगर होता है।,1
क्या आप मिक्सोलॉजिस्ट हैं? मैं आपकी ख़राब शैली से बता सकता हूँ।,0
मैक्सिकन ने बौद्ध बनने का फैसला क्यों किया? वह हर चीज़ के साथ जुआन बनना चाहता था।,0
मेरे दंतचिकित्सक ने मेरे मुँह पर मारा... ...उसने वास्तव में मेरे पेट को चोट पहुँचाई।,0
मैं पूरी तरह से आश्वस्त हूं कि हल्की कृपाण रखने के 3 मिनट के भीतर मैं गलती से खुद को मार डालूंगा।,0
बोस्टन टेरियर की आवाज़ कैसी होती है? बक बक. दुष्ट बक.,0
सैलून में डकैती होने के बाद मैनीक्योरिस्ट को कैसा महसूस हुआ? अपवित्र.,0
यहूदियों की नाक इतनी बड़ी क्यों होती है? क्योंकि हवा मुफ़्त है.,1
"ठीक है, उन्हें यह मत बताना कि तुम नग्न हो, तुम नग्न क्यों हो? लानत है",0
मेरे पास बहुत कुछ नहीं है लेकिन मैं सूखा रख सकता हूँ। जो नम लोगों से कहीं अधिक है.,0
यदि डोनाल्ड ट्रम्प ने मेक्सिकोवासियों पर युद्ध शुरू कर दिया तो युद्ध को क्या कहा जाएगा? विश्व युद्ध जुआन,0
किस कंपनी ने एक मील दूर से डिस्को का अंत होते देखा? खोज करना।,0
यह शर्म की बात है कि ज़िप ऑन-द-फ्लाई कम्प्रेशन एल्गोरिदम नहीं है।,0
"बारटेंडर: क्या आप ड्रिंक चाहते हैं, मिस? मैं: मेरी पसंद क्या है? बारटेंडर: हाँ या नहीं।",0
कौन सा भोजन महिलाओं की यौन इच्छा को बहुत कम कर देता है? शादी का केक,1
6:30 घड़ी पर सबसे अच्छा समय है... ...हाथ नीचे।,0
उच्च क्षमता वाले हमलावर वाहनों पर प्रतिबंध लगाने का समय? हम इसे और कैसे रोक सकते हैं?,0
आप ट्रक में ड्रैगक्वीन को क्या कहते हैं? एक ट्रांसपोर्टर,0
क्या आप जानते हैं कि श्वार्ज़नेगर इन दिनों क्या कर रहे हैं? वह संहारक है.,0
यो माँ इतनी गरीब थी कि मैंने उसके घर में कदम रखा और मैं पिछवाड़े में था।,0
"दो पैरों वाले तिपाई, मैं उन्हें बर्दाश्त नहीं कर सकता।",0
आप डोनाल्ड ट्रंप के विमान को क्या कहते हैं? बाल बल एक...,0
एक जादूगर एक समलैंगिक बार में आता है... ...और जहर खाकर गायब हो जाता है।,0
आलस्य का स्तर: जब दूसरे देशों में सोने का समय होता है तो मुझे ईर्ष्या होती है,1
आप उस लातीनी को क्या कहते हैं जिसकी कार में खराबी आ गई? कार्लोस-टी,0
अर्कांसस में सेक्स कर रहे दो लोगों के बीच होने वाले पसीने को आप क्या कहते हैं? सापेक्षिक आर्द्रता,0
निगलने वाला गिलास गर्दन में एक वास्तविक फलक है।,0
दुनिया के सभी ऑटोट्यून अभी भी डेस्क फैन में बात करने जितने अच्छे नहीं लगते।,0
आदर्श महिला की कल्पना करें. गलत। तुम एक आदमी हो. आप हमेशा गलत होते हैं.,0
क्या आप जानते हैं कि गिलहरी को कैसे पकड़ा जाता है? एक पेड़ पर चढ़ो और एक पागल की तरह व्यवहार करो!,0
मैंने अपने बच्चों को अपने सैमसंग गैलेक्सी नोट 7 पर खेलने दिया...उन्हें बहुत मज़ा आया!,0
तेईस साल के बच्चों के बारे में सबसे अच्छी बात क्या है? उनमें से बीस हैं.,0
स्मॉग फ़ाइलों को यूएसबी स्टिक में कैसे कॉपी करता है? ड्रैगन ड्रॉप,0
"जीवन एक लिंग की तरह है... छोटा, सख्त और मोटा। यह महिलाएं ही हैं जो इसे नरम और आसान बनाती हैं।",1
शिक्षक बांस की छड़ी का उपयोग क्यों करते हैं? क्योंकि जब बेंत 'बम' चलती है तो बच्चा बू हो जाता है!,0
यदि कोई चीनी माँ की तलाश में है तो मैंने अभी एक दर्जन डोनट खरीदे हैं।,0
क्या कैप्टन क्रंच अब तक कर्नल क्रंच नहीं बन जाना चाहिए? जाहिरा तौर पर अनाज शुभंकर एक अंतिम कार्य है।,0
